{
  "id": "L13:poster-prototype-01",
  "self_critique_ref": "L12:poster-prototype-01",
  "target_layer": "L09",
  "reason": "Finding blocking ada di L09 — kontras warna harus direvisi agar judul-acara mendapat prioritas tarikan mata, bukan bentuk aksen. Finding di L07 bersifat minor dan akar masalahnya adalah kontras warna, bukan proporsi grid, sehingga tidak perlu diulang (§5: kembali ke lapis yang gagal, bukan ke L11 secara membabi buta).",
  "previous_attempt_ref": "L11:poster-prototype-01",
  "iteration_count": 1
}
